逞筆◆１,1,1,遂に<span class='word'>蹉跌</span>した。,さてつ,①つまずくこと。②障害や失敗があって、行き詰まること。挫折。
逞筆◆１,139,139,水に臨んで<span class='word'>蝦蟇</span>に擲つ。,がま,ヒキガエル。
逞筆◆１,140,140,智慧と理窟が<span class='word'>内訌</span>する。,ないこう,内部でもめること。うちわもめ。内紛。
逞筆◆１,141,141,何者かに<span class='word'>拉致</span>された。,らち、らっち,いやがる人を無理に連れ去ること。無理に引き連れること。
逞筆◆１,142,142,闖賊は勢い益々<span class='word'>猖獗</span>になり、軈て都も危うし。,しょうけつ,猖蹶。①悪いものが激しい勢いではびこるさま。猛威をふるうこと。②激しくくつがえること。荒れて失敗すること。
逞筆◆１,143,143,殿様の<span class='word'>耳朶</span>に触れる。,じだ,①みみたぶ。②みみ。聴覚・平衡感覚をつかさどる器官。
逞筆◆１,144,144,人里離れた<span class='word'>辺鄙</span>な土地。,へんぴ,都会から遠く離れ、開けていない不便な土地。かたいなか。辺地、辺土、辺陬。
逞筆◆１,145,145,抹香嘗めた<span class='word'>閻魔</span>のよう。,えんま,死者の生前の罪を裁き、罰するという地獄の王。閻魔大王。
逞筆◆１,146,146,連環の<span class='word'>艨艟</span>は悉く舵を曲げた。,もうどう,いくさぶね。敵の船に突き当たって壊す、頑丈なつくりの軍用船。
逞筆◆１,147,147,<span class='word'>剽軽</span>な動作が笑いを誘う。,ひょうきん,明るく滑稽なさま。また、その言動や人。
逞筆◆１,148,148,酷く<span class='word'>酩酊</span>して蹌蹌踉踉たる足運びである。,めいてい,酒を飲んでひどく酔うこと。大酔、泥酔。
逞筆◆１,149,149,<span class='word'>怪訝</span>な顔をするな。,けげん、かいが,理由・事情がわからず合点がいかないこと。あやしみ、いぶかしく思うこと。
逞筆◆１,150,150,今の少年は不遜なり<span class='word'>軽躁</span>なり。,けいそう,軽はずみに騒ぐこと。考えがあさはかなこと。
逞筆◆１,151,151,舞台の<span class='word'>緞帳</span>が下りる。,どんちょう,①刺繡で模様をあしらった厚地の布。仕切りなどに用いる。②劇場で、巻いて上げ下ろしする厚地の幕。
逞筆◆１,152,152,<span class='word'>眈眈</span>としてあたりを睨め廻す。,たんたん,鋭い目つきでねらい見るさま。すきあらばとねらうさま。
逞筆◆１,153,153,生真面目で<span class='word'>朴訥</span>な人柄。,ぼくとつ,木訥。口数が少なく飾り気のないこと。
逞筆◆１,154,154,瑠璃も<span class='word'>玻璃</span>も照らせば光る。,はり,①仏七宝の一つ。水晶。梵語の音訳による語。②ガラスの別称。
逞筆◆１,155,155,少しも<span class='word'>躊躇</span>の色を示さない。,ちゅうちょ,決心がつかず迷うこと。ぐずぐずと、ためらうこと。
逞筆◆１,156,156,柄杓半杯の湯を入れ<span class='word'>茶筅</span>で攪拌する。,ちゃせん,茶筌。①抹茶に湯を注ぎ、かき回して茶をたてる竹製の道具。②「茶筅髪」の略。後ろに束ねてひもで結び、先を茶筅のようにした髪の結い方。
逞筆◆１,157,157,狭隘なる者は<span class='word'>粗鬆</span>なる筆を走らす。,そしょう、そそう,おおざっぱであらいこと。きめがあらく、ざらざらしていること。
逞筆◆１,158,158,<span class='word'>琥珀</span>は腐芥を取らず。,こはく,①地質時代の樹脂が地中で化石になったもの。ふつうは黄褐色で透明。装飾品に用いる。②「琥珀織」の略。平織で横にうねを表した絹織物。着物の帯などに用いる。
逞筆◆１,159,159,<span class='word'>嘖嘖</span>たる名声を博した。,さくさく,人々が口々に言いはやすさま。しきりに言うさま。
逞筆◆１,160,160,<span class='word'>迂闊</span>にも口を滑らす。,うかつ,注意力が足らずに、うっかりしているさま。
逞筆◆１,161,161,全くもって<span class='word'>不埒</span>千万である。,ふらち,具人の道や法にはずれること。不届き。
逞筆◆１,162,162,<span class='word'>蛇蠍</span>の如く忌み嫌う。,だかつ、じゃかつ,蛇蝎。ヘビとサソリ。人がひどく恐れ、嫌うもののたとえ。
逞筆◆１,163,163,<span class='word'>貘</span>の絵を描いてお守りにする。,ばく,獏。①奇蹄目バク科の哺乳類の総称。森林や水辺のやぶにすみ、草食性で、水に入って敵から逃れる。②中国の想像上の動物。人の悪夢を食うといわれ、その皮を敷いて寝ると邪気を避けるという。
逞筆◆１,164,164,今も昔も自由<span class='word'>闊達</span>な校風である。,かったつ,豁達。心が広く、物事にこだわらないようす。
逞筆◆１,165,165,余韻<span class='word'>嫋嫋</span>として絶えざること縷のごとし。,じょうじょう,①しなやかなさま。②風がそよそよと吹くようす。③音声が細く長く続くさま。
逞筆◆１,166,166,やまあらしは<span class='word'>齧歯</span>類に属する。,げっし,齧歯類＝齧歯目の哺乳動物の総称。ネズミ・ウサギ・リスなど犬歯をもたず前歯（門歯）の発達したものの分類名。
逞筆◆１,167,167,我が家には<span class='word'>獏</span>の絵が飾ってある。,ばく,貘。①奇蹄目バク科の哺乳類の総称。森林や水辺のやぶにすみ、草食性で、水に入って敵から逃れる。②中国の想像上の動物。人の悪夢を食うといわれ、その皮を敷いて寝ると邪気を避けるという。
逞筆◆１,168,168,<span class='word'>睚眥</span>の怨みも必ず報ゆ。,がいさい、がいし,ちょっとにらむこと。憎らしそうににらむこと。
逞筆◆１,169,169,<span class='word'>恍惚</span>の域に逍遥する。,こうこつ,①うっとりして我を忘れるさま。恍然。②頭のはたらきが鈍って判断力や理解力が劣るさま。特に、老年になってぼけた状態にいう。
逞筆◆１,170,170,鮑は<span class='word'>蠕動</span>運動によって移動する。,ぜんどう,①うごめくこと。虫が動くこと。蠢動。②筋肉が収縮してできる波が徐々に動いていく運動。消化器官などに見られる。
逞筆◆１,171,171,仏像の<span class='word'>瓔珞</span>が燭光に煌めく。,ようらく,宝石を連ねて仏像の頭・首・胸などを飾るもの。寺院内の天蓋の装飾にも用いる。
逞筆◆１,172,172,梵刹に祈る<span class='word'>阿闍梨</span>、威容を漂わす。,あじゃり、あざり,①徳が高く、弟子を教え導くことのできる僧。②天台宗・真言宗での僧の位。※梵刹（ボンセツ・ボンサツ）＝寺。
逞筆◆１,173,173,町の人々から<span class='word'>慫慂</span>されて会長になる。,しょうよう,そばから誘いすすめること。また、すすめそそのかすこと。
逞筆◆１,174,174,心の<span class='word'>懊悩</span>を愬える友を持つ。,おうのう,心の底で、悩みもだえること。煩悶。苦悩。
逞筆◆１,175,175,該博な知識を持ち、<span class='word'>端倪</span>すべからざる才人である。,たんげい,①物事のはじめと終わり。②物事のなりゆきをおしはかること。推測すること。
逞筆◆１,176,176,大きな<span class='word'>琺琅</span>の鍋で煮込む。,ほうろう,金属器や陶磁器の表面に、さび止めや飾りとして焼き付ける釉。また、焼きつけたもの。瀬戸引き・七宝焼など。
逞筆◆１,177,177,<span class='word'>蕁麻疹</span>が発症する。,じんましん,皮膚がかゆくなり、一時的に赤くはれあがる急性の皮膚病。アレルギーが原因で起こる。
逞筆◆１,178,178,戎馬<span class='word'>倥偬</span>の間に身をおく。,こうそう,あわただしいさま。いそがしいさま。せわしないさま。
逞筆◆１,179,179,鬢に<span class='word'>瑇瑁</span>の筓を挿す。,たいまい,ウミガメ科のカメ。熱帯・亜熱帯の海にすむ。甲羅の長さは約一メートル。甲羅を鼈甲細工の材料にする。
逞筆◆１,180,180,立てば<span class='word'>芍薬</span>座れば牡丹歩く姿は百合の花。,しゃくやく,キンポウゲ科の多年草。アジア北東部原産。初夏、茎頂にボタンに似た大形で美しい紅・白色の花を開く。観賞用。根は薬用。
逞筆◆１,181,181,<span class='word'>昇汞</span>水を用いて消毒した。,しょうこう,塩化第二水銀の別称。無色透明で針状の結晶。猛毒。染色・消毒・写真材料などに用いる。
逞筆◆１,182,182,関東一円を<span class='word'>睥睨</span>していた。,へいげい,俾倪。①横目でにらむこと。流し目で見ること。②城壁のくぼみから敵情をのぞき見ること。転じて、周囲をにらみつけて勢いを示すこと。
逞筆◆１,183,183,親戚から慶事の<span class='word'>招聘</span>状を貰った。,しょうへい,礼をつくして、丁重にまねくこと。
逞筆◆１,184,184,しばらく都門<span class='word'>熱鬧</span>の地を離れた。,ねっとう、ねつどう,多数の人で混雑し、騒がしいこと。
逞筆◆１,185,185,一級過去問題集は<span class='word'>垂涎</span>の資料である。,すいぜん、すいせん、すいえん,①食べたくてよだれをたらすこと。②非常にほしがること。
逞筆◆１,186,186,見知らぬ者が<span class='word'>闖入</span>してきた。,ちんにゅう,突然、無断で入りこんでくること。
逞筆◆１,187,187,目が<span class='word'>瑪瑙</span>のような硬い光を放っている。,めのう,石英などの結晶の混合物。紅・緑・白などの美しいしま模様があり、装飾品などに用いられる。
逞筆◆１,188,188,両者に<span class='word'>軋轢</span>が生じる。,あつれき,関係が悪くなること。仲がこじれること。不和。
逞筆◆１,189,189,凡そ民に喪有れば、<span class='word'>匍匐</span>してこれを救ふ。,ほふく,腹ばうこと。また、腹ばいになって進むこと。
逞筆◆１,190,190,事態は<span class='word'>闡明</span>になった。,せんめい,はっきりしない道理などを明らかにすること。
逞筆◆１,191,191,猛る百獣の<span class='word'>咆哮</span>。,ほうこう,猛獣などが、たけりほえること。また、その声。
逞筆◆１,192,192,黙然として<span class='word'>罵詈</span>讒謗を浴びる。,ばり,ののしること。悪口を言うこと。
逞筆◆１,193,193,他人を<span class='word'>指嗾</span>して騒動を喚起せり。,しそう,使嗾。人をそそのかすこと。けしかけること。教唆。
逞筆◆１,194,194,<span class='word'>開闢</span>以来の出来事。,かいびゃく,①天地が開いた始まり。この世の始まり。創世。②物事の始まり。
逞筆◆１,195,195,<span class='word'>屹度</span>次はいけるさ。,きっと,急度。①必ず。確かに。②きびしく。きっぱりと。表情に強い感情を表すさま。
逞筆◆１,196,196,愚政に対して<span class='word'>瞋恚</span>の炎を燃やす。,しんい、しんに,嗔恚。①はげしく怒ること。瞋怒。②貪欲・愚痴とともに三毒の一つ。自分の心に反するものをはげしく怒り、恨むこと。
逞筆◆１,197,197,ある<span class='word'>箏曲</span>家の次男として生まれる。,そうきょく,ことを演奏する楽曲。ことで伴奏する声楽曲と、ことと他の楽曲とを合わせた器楽曲がある。
逞筆◆１,198,198,江戸の町を<span class='word'>彷徨</span>する。,ほうこう,あてもなくさまよい歩くこと。
逞筆◆１,199,199,虫害や<span class='word'>旱魃</span>に因る被害が甚大である。,かんばつ,干魃。長い期間雨が降らず、水がかれてしまうこと。ひでり。干天。
逞筆◆１,200,200,<span class='word'>捏造</span>記事を摘発された。,ねつぞう、でつぞう,事実でないことを事実らしく作ること。
逞筆◆１,201,201,<span class='word'>微醺</span>を帯びた赭ら顔。,びくん,少し酒に酔うこと。ほろよい。微酔。
逞筆◆１,202,202,憐憫の念から自己<span class='word'>欺瞞</span>に陥る。,ぎまん,あざむき、だますこと。瞞着。
逞筆◆１,203,203,朝廷に奏上せり、諸侯に<span class='word'>諮詢</span>せり。,しじゅん,咨詢。①相談すること。とうこと。②他の機関の意見を求め、参考にすること。
逞筆◆１,204,204,水際に<span class='word'>欸乃</span>の声を聴く。,あいだい、あいない,靄迺。①船頭のかけ声。また、櫓のきしむ音。②舟歌。③きこりの歌。
逞筆◆１,205,205,山には魑魅、水には<span class='word'>魍魎</span>。,もうりょう,古代中国の山の霊気や木石の精。すだま。
逞筆◆１,206,206,<span class='word'>涅槃</span>に達する。,ねはん,①いっさいの煩悩を滅却した、不生不滅の悟りの境地。②死ぬこと。特に、釈迦の死。入滅。
逞筆◆１,207,207,<span class='word'>玲瓏</span>たる美声で歌いはじめた。,れいろう,玲琅。①玉のように輝くさま。美しくすきとおるさま。②金属や玉が触れ合って澄んだ音で鳴るさま。また、そのような人の声のたとえ。
逞筆◆１,208,208,雨水を<span class='word'>濾過</span>して飲料水にする。,ろか,液体や気体をこして、固形の不純物を取り除くこと。
逞筆◆１,209,209,<span class='word'>饂飩</span>一枚笊に盛る。,うどん、うんどん,小麦粉をこねて薄くのばし、細く切ったものをゆでた食品。
逞筆◆１,210,210,この災禍、<span class='word'>魑魅</span>の戯れか。,ちみ,①「魑（すだま）」に同じ。②人間の顔をした化け物。山の神。
逞筆◆１,211,211,<span class='word'>囂囂</span>たる輿論は大雷雨の如し。,ごうごう,人々が騒ぐさま。また、声や音がやかましいさま。
逞筆◆１,212,212,<span class='word'>呱呱</span>の声を上げる。,ここ,乳飲み子の泣く声。
逞筆◆１,213,213,辛うじて<span class='word'>余喘</span>を保つ。,よぜん,今にも絶えそうなかすかな息。虫の息。
逞筆◆１,214,214,<span class='word'>傀儡</span>政権は間もなく転覆した。,かいらい,①「傀儡（くぐつ）」に同じ。②他人に操られる者。
逞筆◆１,215,215,<span class='word'>放埒</span>な行動をとる。,ほうらつ,①「放逸」に同じ。放縦。②酒や色欲にふけること。放蕩。
逞筆◆１,216,216,帰国する人の気持ちを<span class='word'>忖度</span>する。,そんたく,他人の気持ち・考えを、そっと推し量る。
逞筆◆１,217,217,<span class='word'>輓近</span>の世界情勢から目が離せない。,ばんきん,①近ごろ。近年。②古代に対して、最近の世。
逞筆◆１,218,218,忿懣遣る方無い弁駁は明らかな<span class='word'>齟齬</span>であった。,そご,物事がくいちがうこと。行きちがい。
逞筆◆１,219,219,<span class='word'>齠齔</span>にして法学に長ける。,ちょうしん,髫齔。ぬけかわりかけている乳歯。7、8歳の年ごろのこと。また、その頃の子ども。
逞筆◆１,220,220,雪嵐が見る見る<span class='word'>輜重</span>を埋没した。,しちょう,①軍隊の荷物。食糧・武器など。②旅行者の荷物。また、荷物を運ぶ車。
逞筆◆１,221,221,甘味屋で<span class='word'>餡蜜</span>を頂く。,あんみつ,蜜豆の上に餡をのせたもの。
逞筆◆１,222,222,それは<span class='word'>贔屭</span>の引き倒しである。,ひいき、ひき,贔負。気に入ったものに特別に目をかけて、力添えをすること。好意を寄せて、後援すること。また、その後援者。
逞筆◆１,223,223,啜泣は波打つ<span class='word'>歔欷</span>へと変わった。,きょき,噓唏。すすり泣くこと。むせび泣き。
逞筆◆１,224,224,<span class='word'>貪婪</span>な金銭欲。,たんらん、どんらん、とんらん,非常に欲が深いこと。貪欲。
逞筆◆１,225,225,奉仕活動によって<span class='word'>贖罪</span>する。,しょくざい,①金品を出して罪を免れること。②罪ほろぼしをすること。③キリスト教の教義の一つ。キリストが十字架にかかり、人々の罪をあがなったこと。
逞筆◆１,226,226,和服に<span class='word'>繻子</span>の帯。,しゅす,朱子。「繻子織」の略。縦糸を長く浮かせた、光沢のある地の厚い織物。多く、帯地に用いる。サテン。
逞筆◆１,227,227,二年間、終始<span class='word'>齷齪</span>していた。,あくせく、あくそく,偓促。心にゆとりをもてず、目先のことだけに追われてせわしなく物事を行うさま。
逞筆◆１,228,228,<span class='word'>焙烙</span>で豆を炒る。,ほうろく、ほうらく,素焼きの平たい土鍋。
逞筆◆１,229,229,<span class='word'>衲衣</span>と袈裟を着ている半身像。,のうえ,①僧衣。衲袈裟。②僧侶、特に、禅宗の僧。
逞筆◆１,230,230,万一の<span class='word'>僥倖</span>を願う。,ぎょうこう,思いがけない幸運。こぼれざいわい。
逞筆◆１,231,231,<span class='word'>齲歯</span>の孫娘笑わんとして成さず。,うし、くし,虫歯。
逞筆◆１,232,232,<span class='word'>啖呵</span>を切る。,たんか,①威勢よく、歯切れのよい言葉。②香具師などが品物を売るときの口上。
逞筆◆１,233,233,雑務が<span class='word'>輻輳</span>する。,ふくそう,輻湊。いろいろな場所から物事が一か所に寄り集まること。混み合うこと。
逞筆◆１,234,234,子どもたちが公園で和気<span class='word'>藹藹</span>と遊んでいる。,あいあい,靄靄。①なごやかなさま。②草木が盛んに茂るさま。盛んなさま。
逞筆◆１,235,235,些細な釁端から<span class='word'>刃傷</span>沙汰に及んだ。,にんじょう,刃傷沙汰＝刃物で人を傷つけるような争いや、騒ぎ。
逞筆◆１,236,236,華容<span class='word'>婀娜</span>として、我をして餐を忘れしむ。,あだ,美しくしとやかなさま。また、女性の粋で色っぽいさま。
逞筆◆１,237,237,彼の欲は耿耿として<span class='word'>須臾</span>も熄まず。,しゅゆ、すゆ,しばらく。少しの間。寸刻。※熄む（や-む）
逞筆◆１,238,238,皓白たる<span class='word'>襦袢</span>姿。,じゅばん、じばん,和服用の下着。肌着。肌襦袢・長襦袢など。
逞筆◆１,239,239,父の面影を<span class='word'>彷彿</span>とさせた。,ほうふつ,髣髴。①よく似ているさま。はっきりと思い浮かぶさま。②姿や形などが、ぼんやりと見えるさま。
逞筆◆１,240,240,公爵を<span class='word'>誣告</span>した罪を咎める。,ぶこく,他人を陥れるため、故意に偽った事実を告げること。
逞筆◆１,241,241,<span class='word'>轆轤</span>を回転させて食器を作る。,ろくろ,①「轆轤台」の略。木製の回転する台で、陶器を作るのに用いる。②物を引き寄せたり、つるしあげたりするのに使う滑車。井戸水のくみ上げなどに用いる。③傘の柄の上部にある、骨の集まった開閉の装置。
逞筆◆１,242,242,人を喰ったような<span class='word'>慇懃</span>無礼な文章。,いんぎん,①ねんごろなこと。礼儀正しくていねいなこと。②うれえいたむさま。③よしみ。特に、男女の思慕の情。
逞筆◆１,243,243,暮し向きの<span class='word'>慳貪</span>な男。,けんどん,①非常にけちで欲が深いこと。②思いやりがなく無愛想なこと。つっけんどん。邪慳。
逞筆◆１,244,244,京都で薯蕷<span class='word'>饅頭</span>を頂く。,まんじゅう,小麦粉などをこねて作った皮の中に、あんや肉などを入れて蒸した食べ物。※薯蕷（ジョウヨ、とろろ）
逞筆◆１,245,245,不平が社会に<span class='word'>胚胎</span>した。,はいたい,①身ごもること。②物事の起こる原因が生じること。きざし。
逞筆◆１,246,246,いつか<span class='word'>懈怠</span>来て腐儒となり果てり。,けたい、けだい、かいたい,①心がゆるんでおこたること。なまけること。懈惰。怠懈。②仏教で修行をおこたること。
逞筆◆１,247,247,彼女の伎倆は進み<span class='word'>儕輩</span>を擢んでる。,せいはい、さいはい,同じ仲間。ともがら。同類。同輩。
逞筆◆１,248,248,荒怠相誡め、<span class='word'>自彊</span>息まざるべし。,じきょう,自分から進んで努力し励むこと。休まずに努めること。※息まず（や-まず）
逞筆◆１,249,249,天から<span class='word'>隕石</span>が落ちてくるかのよう。,いんせき,流星が大気中で燃え切らず、地球上に落ちてきたもの。
逞筆◆１,250,250,<span class='word'>膀胱</span>の緊張が限界に達する。,ぼうこう,脊椎動物の排泄器官。腎臓より送られてくる尿を、一時的にためておく臓器。
逞筆◆１,251,251,<span class='word'>螺鈿</span>細工の上等な文箱。,らでん,螺甸。漆工芸の技法の一つ。オウムガイやアコヤガイなどの殻から真珠光を放つ部分を切り取った薄片を物の表面に埋めこみ、装飾とするもの。※文箱（ふばこ）
逞筆◆１,252,252,<span class='word'>鰥寡</span>孤独を愍れみ救う。,かんか,矜寡。妻を失った男と夫を失った女。
逞筆◆１,253,253,<span class='word'>無辜</span>の学問に弾圧があった。,むこ,罪がないこと。また、その人。無罪。
逞筆◆１,254,254,他人の<span class='word'>疝気</span>を頭痛に病む。,せんき,漢方で、下腹部や腰の筋肉が引きつり痛む病気の総称。疝病。
逞筆◆１,255,255,武事に文事に<span class='word'>切磋</span>琢磨する。,せっさ,切瑳。学問に励み徳義を磨くこと。努力を重ねること。
逞筆◆１,256,256,彼の付和雷同ぶりには殆<span class='word'>辟易</span>している。,へきえき,①勢いや困難に押されて立ちのいたり、しりごみしたりすること。②手におえなくて困ること。閉口。
逞筆◆１,257,257,弁士は聴衆の前で<span class='word'>獅子吼</span>した。,ししく,①熱弁をふるうこと。大演説。②悪魔や外道をも恐れ伏せさせたという、獅子がほえるような釈迦の説法。
逞筆◆１,258,258,<span class='word'>茗荷</span>の餅を仏壇に供える。,みょうが,ショウガ科の多年草。熱帯アジア原産で、暖地の山林に野生化。また、栽培もする。夏、根元から淡赤褐色の苞に包まれた花穂を出し淡黄色の花が咲く。若い花穂と若芽は食用。メガ。
逞筆◆１,259,259,良心の<span class='word'>呵責</span>に苦しむ。,かしゃく,きびしくとがめること。責めて苦しめること。
逞筆◆１,260,260,千人の諾諾は、一士の<span class='word'>諤諤</span>に如かず。,がくがく,正しいと思うことを遠慮せずに述べるさま。直言するさま。
逞筆◆１,261,261,二人は<span class='word'>伉儷</span>の約を結んだ。,こうれい,夫婦。伴侶。つれあい。配偶者。
逞筆◆１,262,262,至尊の<span class='word'>忌諱</span>に触れる。,きき、きい,いみ嫌うこと。おそれ嫌うこと。
逞筆◆１,263,263,厳しい詮議立てに<span class='word'>放屁</span>で返答する。,ほうひ,屁を放つこと。おならをすること。
逞筆◆１,264,264,気散じに<span class='word'>諧謔</span>の一句を詠む。,かいぎゃく,ちょっとした冗談。おどけ。しゃれ。ユーモア。おどけた話や言葉。
逞筆◆１,265,265,やっとの思いで錠剤を<span class='word'>咽下</span>した。,えんげ、えんか,嚥下。のみこむこと。
逞筆◆１,266,266,<span class='word'>執拗</span>に自説を張り上げる。,しつよう,①意地を張り、自分の考えをあくまで通そうとするさま。②しつこいさま。
逞筆◆１,267,267,歌舞伎界の<span class='word'>巨擘</span>と称えられる。,きょはく,①親指。②集団の中で、特に目立ってすぐれた人。かしらの人。
