逞筆◆１,1,1,遂に<span class='word'>蹉跌</span>した。,さてつ,①つまずくこと。②障害や失敗があって、行き詰まること。挫折。
逞筆◆１,268,268,世相を<span class='word'>諷刺</span>する。,ふうし,風刺。それとなく皮肉ること。特に、社会や人物の欠点や罪悪などを、遠回しにおもしろく批評すること。
逞筆◆１,269,269,<span class='word'>鴃舌</span>の人、先王の道を非とす。,げきぜつ,モズの鳴き声の意から、意味が分からないために、ただやかましく聞こえる外国の言葉。
逞筆◆１,270,270,街中で旧師と<span class='word'>邂逅</span>する。,かいこう,思いがけず出あうこと。運命的な出あい。めぐりあい。
逞筆◆１,271,271,元気<span class='word'>潑溂</span>たる青年。,はつらつ,潑剌。生き生きとして、元気のよいさま。活発。
逞筆◆１,272,272,<span class='word'>洒脱</span>な風格。,しゃだつ,灑脱。さっぱりしていて俗気がないこと。洒落。
逞筆◆１,273,273,重い<span class='word'>疱瘡</span>に罹る。,ほうそう,皰瘡。天然痘の別称。高熱を発し、赤い発疹ができて痕を残す感染症。病原体はウイルス。もがさ。痘瘡。
逞筆◆１,274,274,改革の気運が<span class='word'>澎湃</span>として起こった。,ほうはい,彭湃、滂湃。①水の勢いが盛んなさま。②物事が盛んに起こるさま。
逞筆◆１,275,275,名匠の手捌きに<span class='word'>瞠目</span>する。,どうもく,感心や驚きのあまり、目を見張ること。
逞筆◆１,276,276,臣は君の<span class='word'>猜疑</span>心の強さを知悉している。,さいぎ,人の行いなどを素直に受け取れず、ねたんだり、うたがったりすること。
逞筆◆１,277,277,真夏の如き<span class='word'>溽暑</span>が続く。,じょくしょ,①むし暑いこと。②陰暦六月の異名。
逞筆◆１,278,278,最後<span class='word'>通牒</span>を発する。,つうちょう,①書面で通知すること。また、その書面。②通達の旧称。③国際法上、一方的に国家の態度・政策などを相手国に通知する文書。
逞筆◆１,279,279,長兄の警句を<span class='word'>咀嚼</span>する。,そしゃく,①食べ物をかみくだくこと。②物事や文章などを深く味わい理解すること。
逞筆◆１,280,280,曩祖より紡がれる<span class='word'>煩瑣</span>な系図。,はんさ,こまごまとしていて、わずらわしいさま。
逞筆◆１,281,281,曠野の<span class='word'>落暉</span>に騏驥は駛せる。,らっき,沈みかけている太陽。夕日。入り日。落陽。
逞筆◆１,282,282,<span class='word'>狡猾</span>たる籌筴の成功に北叟笑む。,こうかつ,狡黠、佼黠、巧黠。ずるがしこくて悪知恵がはたらくさま。
逞筆◆１,283,283,この方とは<span class='word'>昵懇</span>の間柄です。,じっこん,入魂。親しくつき合うさま。こころやすいこと。懇意。
逞筆◆１,284,284,他人事に<span class='word'>容喙</span>するものではない。,ようかい,横合いから口を出すこと。さしでぐち。
逞筆◆１,285,285,能く成すには<span class='word'>先蹤</span>を肄うべし。,せんしょう,先人の行った事業の跡。
逞筆◆１,286,286,俳聖に<span class='word'>親炙</span>して弟子となった。,しんしゃ、しんせき,その人に親しく接して影響を受け、感化されること。
逞筆◆１,287,287,大宰府への下向は官位<span class='word'>褫奪</span>に等しい。,ちだつ,衣服をはぎ取ること。また、官位や権利などを取り上げること。
逞筆◆１,288,288,<span class='word'>逆睹</span>しがたい形勢である。,ぎゃくと、げきと,逆覩。あらかじめ見通しをつけること。
逞筆◆１,289,289,金属製の<span class='word'>艤装</span>を施す。,ぎそう,船の完成後、航海に必要な装備を取り付けて就航の準備をすること。また、その装備。ふなよそい。船装。
逞筆◆１,290,290,春寒<span class='word'>料峭</span>の候に発つ。,りょうしょう,風が肌寒く感じられること。
逞筆◆１,291,291,愈愈<span class='word'>啓蟄</span>の候を迎える。,けいちつ,二十四節気の一つ。三月五、六日ころ。
逞筆◆１,292,292,<span class='word'>敬虔</span>の意を以て福音を説く。,けいけん,うやまい深くつつしむこと。特に、神仏にうやまい仕えるさまにいうことが多い。
逞筆◆１,293,293,<span class='word'>肇国</span>の記念日を休みとする。,ちょうこく,はじめて国を建てること。国を興すこと。
逞筆◆１,294,294,官僚間の繁文<span class='word'>縟礼</span>に縛られる。,じょくれい,こまごまとわずらわしい礼儀作法。
逞筆◆１,295,295,<span class='word'>麾下</span>の将兵数万に達する。,きか,旗下。大将の直属の部下。将軍直属の家来。
逞筆◆１,296,296,この<span class='word'>黎明</span>を齎した英傑。,れいめい,①夜明け。明け方。②夜明けにあたる、物事が始まる時期のたとえ。また、新しい時代や文化・芸術などの始まり。
逞筆◆１,297,297,疑懼の念が<span class='word'>蠢動</span>する。,しゅんどう,①虫がうごめくこと。②つまらないものが騒ぎ動くこと。
逞筆◆１,298,298,洋風の<span class='word'>瀟洒</span>な家に住んでいる。,しょうしゃ,瀟灑。すっきりとして洗練されているようす。
逞筆◆１,299,299,天譴<span class='word'>天誅</span>の下に泰平在り。,てんちゅう,①天が下す罰。②天に代わって悪人の罪を責め、罰を加えること。また、その罰。
逞筆◆１,300,300,伯曰わく、<span class='word'>猥褻</span>は憂き世に必要である。,わいせつ,みだらなこと。性に関するいやらしいこと。
逞筆◆１,301,301,その瞳睛に王位<span class='word'>篡奪</span>の意を巡らしている。,さんだつ,君主を滅ぼして地位や権力を手に入れること。
逞筆◆１,302,302,洋上に<span class='word'>対峙</span>するは百艘の艨艟。,たいじ,①山などが競い合うようにそびえ立っていること。②対立する二つの勢力が、にらみ合っていること。
逞筆◆１,303,303,夜叉王が<span class='word'>眷属</span>を従えてやってくる。,けんぞく,眷族。①血のつながりがある者。身内。一族。親族。②目をかけている者。家来。手下。
逞筆◆１,304,304,恩師の忠告を<span class='word'>反芻</span>する。,はんすう,①ウシ・ヒツジ・ラクダなどが、一度飲みこんだ食物を、また、口に戻してかむこと。②言葉の意味などをくり返し考えたり味わったりすること。
逞筆◆１,305,305,密航中の貨物船を<span class='word'>拿捕</span>する。,だほ,とらえること。特に、軍艦などが領海を侵犯した外国の船舶をとらえること。
逞筆◆１,306,306,唐草模様の<span class='word'>袱紗</span>に漆器を包む。,ふくさ,服紗、帛紗。①絹などの小形のふろしき。進物などの上に掛ける。②茶の湯で、茶器をふいたり茶碗を受けたりするのに使う絹布。
逞筆◆１,307,307,身の丈程の<span class='word'>棍棒</span>を振回す膂力。,こんぼう,①丸い木の棒。②体操競技で使用する、とっくり形の木の棒。インディアンクラブ。
逞筆◆１,308,308,新聞の批評に<span class='word'>反駁</span>を加える。,はんばく,他人の批判や攻撃に対して、論じかえすこと。
逞筆◆１,309,309,<span class='word'>登攀</span>技術が高い。,とうはん、とはん,高山や岩崖などをよじのぼること。
逞筆◆１,310,310,秕政なれば文武は<span class='word'>凋落</span>す。,ちょうらく,①草花などがしおれ、枯れること。また、容色が衰えること。②勢いがなくなり落ちぶれること。※秕政（ヒセイ）
逞筆◆１,311,311,この<span class='word'>稀有</span>の機会を逃さず。,けう,希有。まれで珍しいこと。めったにないこと。
逞筆◆１,312,312,心身<span class='word'>羸弱</span>し悄然として嘆く。,るいじゃく,体が弱いこと。また、疲労で衰弱すること。
逞筆◆１,313,313,人口の<span class='word'>稠密</span>な地域である。,ちゅうみつ,綢密。一か所に多く集まること。びっしりとこみ合っていること。
逞筆◆１,314,314,<span class='word'>老獪</span>も処世の筌蹄である。,ろうかい,長い経験から世間慣れして、ずる賢いこと。
逞筆◆１,315,315,日がな一日<span class='word'>無聊</span>を託つ。,ぶりょう,①することがなく、退屈なこと。つれづれ。②気になることがあって楽しめないこと。
逞筆◆１,316,316,経済弱者を<span class='word'>裨益</span>する。,ひえき,おぎなって利益を与えること。助けとなること。役に立つこと。
逞筆◆１,317,317,道徳的<span class='word'>誤謬</span>に陥る。,ごびゅう,論理や知識などのあやまり。
逞筆◆１,318,318,人間が人間を裁くことは<span class='word'>僭越</span>である。,せんえつ,身分・分限を越え、出過ぎること。
逞筆◆１,319,319,弱冠にして<span class='word'>痔瘻</span>を患う。,じろう,痔疾の一種。肛門の辺りに穴があいて膿が出る病気。あなじ。
逞筆◆１,320,320,血を見て<span class='word'>癲癇</span>を起こす。,てんかん,突然の発作で意識を失ったりけいれんを起こしたりする病気。脳の損傷や遺伝的素質などによって起こる症状。
逞筆◆１,321,321,<span class='word'>社稷</span>を憂うる臣少なし。,しゃしょく,昔、中国で建国のときに守り神として天子がまつった土地の神（社）と五穀の神（稷）。転じて、国家。
逞筆◆１,322,322,古人の粉本を摸し意匠を<span class='word'>剽窃</span>する。,ひょうせつ,他人の詩歌や文章などをぬすんで、自分のものとして発表すること。盗作、剽賊。
逞筆◆１,323,323,市史の<span class='word'>編纂</span>に従事する。,へんさん,多くの材料を集め、ある方針のもとに手を加えて書物を作ること。
逞筆◆１,324,324,檄書を<span class='word'>封緘</span>して捺印する。,ふうかん,手紙などに封をして、とじること。
逞筆◆１,325,325,先生の輝かしい生涯を<span class='word'>縷縷</span>切切と語る。,るる,①糸のように、細く長く続くさま。②こまごまと詳しく述べるさま。
逞筆◆１,326,326,他からの<span class='word'>掣肘</span>を受けない。,せいちゅう,そばから干渉して自由な活動を妨げること。
逞筆◆１,327,327,日月<span class='word'>荏苒</span>として代謝す。,じんぜん,①歳月がいたずらに過ぎていくさま。②物事がはかどらず延び延びになるさま。
逞筆◆１,328,328,呼ぶ声に<span class='word'>莞爾</span>として片手を上げた。,かんじ,にっこりとほほえむさま。にこやかに笑うさま。
逞筆◆１,329,329,錆びた<span class='word'>薬莢</span>が散逸する現場。,やっきょう,真鍮製の筒に火薬を入れたもの。銃砲に取り付けて弾丸の発射に用いる。
逞筆◆１,330,330,<span class='word'>嶄然</span>として頭角を見す。,ざんぜん,一段と高く抜きんでているさま。ひときわ目立つさま。※見す（あらわす）
逞筆◆１,331,331,大いに<span class='word'>逕庭</span>有りて、人情に近からず。,けいてい,径庭。大きなへだたり。差異。
逞筆◆１,332,332,倒れ行く幕府の<span class='word'>大廈</span>。,たいか,大きな建物。
逞筆◆１,333,333,終身<span class='word'>膠漆</span>心まさに在るべし。,こうしつ,①にかわと、うるし。②親密な間柄。固い友情。
逞筆◆１,334,334,赤ん坊が唸り声や<span class='word'>喃語</span>をあげる。,なんご,①男女の仲むつまじいささやきあい。②赤ん坊が発する、まだ言葉にならない音。
逞筆◆１,335,335,<span class='word'>幔幕</span>の内にて籌を廻らす。,まんまく,式場や会場などのまわりに張り巡らす幕。※籌（はかりごと）
逞筆◆１,336,336,錦を衣て<span class='word'>尚絅</span>す。,しょうけい,衣錦尚絅＝才能や徳を、外にあらわに出さないこと。※衣て（きて）
逞筆◆１,337,337,酖溺し<span class='word'>蹌踉</span>蹣跚として歩く。,そうろう,よろめくさま。足元がふらつくさま。蹌蹌。
逞筆◆１,338,338,橋の袂に<span class='word'>擱坐</span>した戦車。,かくざ,擱座。①船が浅瀬に乗りあげること。座礁。②戦車などがこわれて動けなくなること。
逞筆◆１,339,339,傾城傾国をどうする<span class='word'>了簡</span>もなかろうに。,りょうけん,了見、料簡。①考え。②許すこと。
逞筆◆１,340,340,心の中の塵埃や<span class='word'>渣滓</span>を吐き出す。,さし,液体の底に沈んでいるかす。沈殿物。おり。
逞筆◆１,341,341,非望を<span class='word'>覬覦</span>するの愚を犯していた。,きゆ,身分不相応のことをのぞみねがうこと。また、そのようなのぞみやもくろみ。
逞筆◆１,342,342,目の前の激務に<span class='word'>鞅掌</span>している。,おうしょう,休みをとれないほど忙しく働くこと。
逞筆◆１,343,343,旌旗林の如く風に翻って<span class='word'>喊声</span>天地に震う。,かんせい,大きなわめき声。鬨の声。
逞筆◆１,344,344,麒麟児の<span class='word'>崑玉</span>の詩を詠む。,こんぎょく,①崑崙山から産する玉。②転じて、すぐれた詩文をいう。
逞筆◆１,345,345,亟遊の地に<span class='word'>縊死</span>す。,いし,首をくくって死ぬこと。首つり。
逞筆◆１,346,346,<span class='word'>尺蠖</span>の屈するは、以て信びんことを求むるなり。,せっかく、せきかく、しゃっかく,シャクトリムシの別名。
逞筆◆１,347,347,声を嚥んで<span class='word'>動悸</span>を抑えている。,どうき,心臓が普段より激しく鼓動すること。また、その鼓動。※嚥む（の-む）
逞筆◆１,348,348,漢字の<span class='word'>偏旁</span>を楷書で書く。,へんぼう,漢字の偏（ヘン）と旁（つくり）。多く、漢字構成の左側と右側の部分。
逞筆◆１,349,349,文壇的人非人として<span class='word'>擯斥</span>される。,ひんせき,しりぞけてのけものにすること。排斥。
逞筆◆１,350,350,<span class='word'>斗筲</span>の人、何ぞ算うるに足らんや。,としょう、とそう,①度量のせまいこと。器量の小さいこと。②禄のわずかなこと。俸給の少ないこと。※算える（かぞ-える）
逞筆◆１,351,351,<span class='word'>薫蕕</span>は器を同じくせず。,くんゆう,①香気のある草と、悪臭のする草。②善人と悪人。君子と小人。また、善悪のたとえ。
逞筆◆１,352,352,<span class='word'>琴瑟</span>相和す。,きんしつ,琴瑟相和＝夫婦が仲むつまじいたとえ。また、兄弟や友人の仲のよいことにもいう。比翼連理。
逞筆◆１,353,353,<span class='word'>聚斂</span>の臣あらんより寧ろ盗臣あれ。,しゅうれん,①一か所にあつめてそれを取りこむこと。②支配者が租税を厳しく取り立てること。
逞筆◆１,354,354,先民言うあり、<span class='word'>芻蕘</span>に詢る。,すうじょう、すうぎょう,草を刈る人ときこり。転じて、低い身分の人。庶民。
逞筆◆１,355,355,<span class='word'>薏苡</span>の謗、自ら明らかにするあたわず。,よくい、よくし,草の名。ハトムギ。また、ハスの実。
逞筆◆１,356,356,寸間も<span class='word'>苟且</span>に過ごさなかった。,こうしょ,その場限りの間に合わせであること。一時のがれ。かりそめ。なおざり。
逞筆◆１,357,357,これを<span class='word'>毫釐</span>に失すれば謬るに千里を以てす。,ごうり,ほんの少しであること。きわめて微量であること。わずか。釐毫。
逞筆◆１,358,358,九仞の功を<span class='word'>一簣</span>に虧く。,いっき,石や土を運ぶための竹やわらで編んだかご一つ。また、それに一杯分のわずかな土。
逞筆◆１,359,359,早起<span class='word'>盥漱</span>して本堂に籠もる。,かんそう,手を洗い、口をすすぐこと。
逞筆◆１,360,360,あの大学者は<span class='word'>僻陬</span>の地に育った。,へきすう,へんぴな土地。僻地。
逞筆◆１,361,361,悪漢を捕らえて<span class='word'>囹圄</span>に錮す。,れいご、れいぎょ,囹圉。罪人をとらえて、閉じ込めておく所。ひとや。牢屋。
逞筆◆１,362,362,彊大な颱風が日本を<span class='word'>震撼</span>させた。,しんかん,ふるえ動くこと。また、ショックを与えること。
逞筆◆１,363,363,天神<span class='word'>地祇</span>の冥助を蒙り給う。,ちぎ,①地の神。国土を守る神。②天孫降臨の前から、日本の国土を治めていた神。くにつかみ。※冥助（ミョウジョ）
逞筆◆１,364,364,彼<span class='word'>裸裎</span>すと雖も、安んぞ能く我を汚さん。,らてい,①はだか。②極めて無礼なさま。
逞筆◆１,365,365,<span class='word'>鶴唳</span>を聞いて軍兵は退却した。,かくれい,①鶴が鳴くこと。また、その声。②悲しげな文章や言葉。鶴の鳴き声が悲しげなことから。
逞筆◆１,366,366,関関たる<span class='word'>雎鳩</span>は、川の洲に在り。,しょきゅう,①鶚（みさご）の異名。②淑徳のある女性のたとえ。
逞筆◆１,367,367,朝菌は晦朔を知らず、<span class='word'>蟪蛄</span>は春秋を知らず。,けいこ,にいにいぜみ。
逞筆◆１,368,368,泥酔し<span class='word'>蹣跚</span>として跋歩する。,まんさん、はんさん,よろめきながら歩くさま。
逞筆◆１,369,369,一月、<span class='word'>馥郁</span>たる梅の香。,ふくいく,香り高いさま。よい香りがたちこめるさま。
逞筆◆１,370,370,奢侈軽薄は亡国の<span class='word'>鴆毒</span>となる。,ちんどく,酖毒。①鴆という毒鳥の羽にある猛毒。また、その羽を酒に浸して得た毒物。②猛毒。非常な害毒。
逞筆◆１,371,371,酒色に顧慮を闕いては<span class='word'>沈湎</span>は免れず。,ちんめん,酒におぼれて、すさんだ不健康な生活をすること。※闕く（か-く）
逞筆◆１,372,372,勝利の栄冠は<span class='word'>炳</span>として頭上にある。,へい,光り輝いて。あきらかに。
逞筆◆１,373,373,話をして伶俐<span class='word'>侏儒</span>を甄別する。,しゅじゅ,朱儒。①身長がきわめて低い人。②見識のない人をあざける語。③役者。
逞筆◆１,374,374,大河の潤す<span class='word'>膏腴</span>なる大地である。,こうゆ,地味が豊かで肥えていること。また、その土地。膏沃、肥沃。
逞筆◆１,375,375,志気の無さゆえ<span class='word'>巾幗</span>を贈られる。,きんかく,①中国で、女性の髪飾り。一説に、女性が喪中にかぶる頭巾とも。②女性。また、女性的なもののたとえ。
逞筆◆１,376,376,濁穢を<span class='word'>蟬蛻</span>し、もって塵埃の外に浮游す。,せんぜい,①セミの抜け殻。うつせみ。②俗世間を超越すること。解脱。蟬脱。※濁穢（ジャクエ）、穢濁（ワイダク）
逞筆◆１,377,377,嘔啞<span class='word'>嘲哳</span>、聴くを為し難し。,ちょうたつ、とうたつ,①鳥のさえずるにぎやかな声の形容。②ぺちゃぺちゃとわかりにくいことばをしゃべるさま。③楽器の音が調子はずれで、やかましいさま。
逞筆◆１,378,378,雄弁に<span class='word'>瞞著</span>一切なし。,まんちゃく,瞞着。あざむくこと。だますこと。ごまかすこと。
逞筆◆１,379,379,慢性的な<span class='word'>譫妄</span>状態が続いている。,せんもう、せんぼう,意識障害の一種。意識が混濁し、錯覚や妄想などを伴う。認知症・アルコール依存症などに見られる。
逞筆◆１,380,380,濃霧の中に<span class='word'>倏忽</span>として氷山が現れた。,しゅっこつ、しゅくこつ,時が非常にはやく過ぎるさま。また、時間が非常に短いさま。
逞筆◆１,381,381,長身<span class='word'>白皙</span>の紳士である。,はくせき,肌の色が白いこと。色白。
逞筆◆１,382,382,人世の繫縛を<span class='word'>斫断</span>する。,しゃくだん,たちきること。切断。
逞筆◆１,383,383,<span class='word'>絨緞</span>の上に餉台を一つ置く。,じゅうたん,絨毯。毛織物の一種で、床に敷く物。カーペット。
逞筆◆１,384,384,<span class='word'>螻蟻</span>の誠、拠を信ずる処無し。,ろうぎ,①ケラとアリ。②ちっぽけな、つまらないもののたとえ。
逞筆◆１,385,385,<span class='word'>妲己</span>のお百。,だっき,①中国、殷の紂王の寵妃。淫楽・残忍を極め、王とともに周の武王に殺害された。②性悪で人に害を与える女。
逞筆◆１,386,386,むやみに<span class='word'>打擲</span>するな。,ちょうちゃく,人をうちたたくこと。なぐること。
逞筆◆１,387,387,孔の字の右側は<span class='word'>乙繞</span>という。,おつにょう,漢字の繞の一。「乞」「乱」などの「乙」「⺃」の部分。
逞筆◆１,388,388,ほしいままに大臣を<span class='word'>黜陟</span>するの非をせめる。,ちゅっちょく,功績のない者をしりぞけて、功績のある者を昇官させること。
逞筆◆１,389,389,形影相弔い五常<span class='word'>愧赧</span>す。,きたん,深くはじて赤面すること。
逞筆◆１,390,390,<span class='word'>矻矻</span>として少しも怠らない。,こつこつ,兀兀。①たゆまずに精を出して働くさま。②疲れ果てるさま。
逞筆◆１,391,391,敬事有らずんば、敢えて<span class='word'>袒裼</span>せず。,たんせき,上着をぬぎ、肩をあらわすこと。はだぬぎ。
逞筆◆１,392,392,旧弊は廃却して新しい道徳を<span class='word'>提撕</span>する。,ていせい、ていぜい,①手に提げて持つ。②後輩や後進の者を教え導く。③励ます。
逞筆◆１,393,393,夜は<span class='word'>卓袱</span>料理で有名な店で食事をした。,しっぽく,①中国風の朱塗りの食卓。②麺類に、野菜・きのこ・かまぼこを入れて煮たもの。
逞筆◆１,394,394,<span class='word'>卓犖</span>たる論弁の才が具わる。,たくらく,このうえなく、すぐれていること。
逞筆◆１,395,395,理非曲直を<span class='word'>甄別</span>する。,けんべつ,はっきりと区別すること。はっきりと見分けること。
逞筆◆１,396,396,出席者に<span class='word'>忌憚</span>のない意見を促す。,きたん,いみはばかること。遠慮すること。
逞筆◆１,397,397,<span class='word'>辣腕</span>家として有名だ。,らつわん,仕事などを、てきぱきと巧みに処理する能力をもっていること。腕利き。すご腕。敏腕。
逞筆◆１,398,398,<span class='word'>忽焉</span>として逝く。,こつえん,たちまち。突然。にわかに。忽然。
逞筆◆１,399,399,人心から<span class='word'>乖離</span>する。,かいり,①わかれはなれること。②心が合わなくなってそむきはなれること。乖隔。離反。
逞筆◆１,400,400,全くの<span class='word'>冤罪</span>だ。,えんざい,無実の罪。ぬれぎぬ。冤枉。
逞筆◆１,401,401,<span class='word'>倉廩</span>実ちて礼節を知る。,そうりん,穀物を入れておく、くら。米ぐら。※実ちる（み-ちる）
逞筆◆１,402,402,<span class='word'>麝香</span>は薬科にも使われる。,じゃこう,ジャコウジカの雄の下腹部から出る分泌物を乾燥させた香料。黒褐色の粉末で強い香気があり、薬科にも使用。
逞筆◆１,403,403,<span class='word'>獺祭</span>書屋主人と称した。,だっさい,①かわうそが自分のとった魚を食う前に並べること。②転じて、詩文などを作るときに、多くの参考書を左右に並べること。
逞筆◆１,404,404,名を<span class='word'>竹帛</span>に垂る。,ちくはく,書物。歴史書。
